{
  "apiVersion": "lattice.socioprophet.dev/v1",
  "kind": "RuntimeAsset",
  "metadata": {
    "name": "prophet-python-ml",
    "version": "0.1.0",
    "createdAt": "2026-04-26T00:00:00Z",
    "labels": {
      "runtime": "python-ml",
      "surface": "lattice-studio"
    }
  },
  "spec": {
    "runtimeClass": "notebook",
    "languages": ["python", "javascript", "shell", "sql"],
    "channels": [
      {"name": "nixpkgs", "type": "nixpkgs", "trusted": true},
      {"name": "prophet-core", "type": "prophet", "trusted": true}
    ],
    "build": {
      "system": "nix",
      "entrypoint": "runtimes/prophet-python-ml/flake.nix",
      "lockfile": "runtimes/prophet-python-ml/flake.lock",
      "sourceRef": "local",
      "builderId": "lattice-forge-nix-builder"
    },
    "artifacts": [
      {"name": "runtime-closure", "role": "nix-closure", "digest": "sha256:7777777777777777777777777777777777777777777777777777777777777777"},
      {"name": "runtime-sbom", "role": "sbom", "digest": "sha256:8888888888888888888888888888888888888888888888888888888888888888"}
    ],
    "provenance": {
      "attestations": ["slsa", "in-toto"],
      "sourceRefs": ["local-source-ref"],
      "builderId": "lattice-forge-nix-builder"
    },
    "sbom": {
      "formats": ["spdx", "cyclonedx"],
      "digest": "sha256:9999999999999999999999999999999999999999999999999999999999999999"
    },
    "signature": {
      "type": "sigstore",
      "bundleRef": "pending-demo-bundle",
      "digest": "sha256:aaaaaaaaaaaaaaaaaaaaaaaaaaaaaaaaaaaaaaaaaaaaaaaaaaaaaaaaaaaaaaaa"
    },
    "scan": {"vulnerability": "not-run", "license": "not-run", "policy": "not-run"},
    "policy": {"network": "restricted", "secrets": "scoped", "accelerators": ["cpu"], "defaultIsolation": "container"},
    "compatibility": {
      "surfaces": [
        "jupyter",
        "jupyterlab",
        "zeppelin",
        "observable",
        "quarto",
        "lattice-studio",
        "ray",
        "beam",
        "agentplane",
        "sourceos-user",
        "prophet-platform"
      ]
    },
    "telemetry": {"traceRequired": true, "metricSet": ["build-duration", "scan-duration", "artifact-size", "promotion-result"]},
    "promotion": {"channel": "dev", "rollbackRef": "runtime/prophet-python-ml/0.0.1"}
  }
}
