{
  "apiVersion": "lattice.socioprophet.dev/v1",
  "kind": "RuntimeAsset",
  "metadata": {
    "name": "prophet-python-ml",
    "version": "0.1.0",
    "createdAt": "2026-04-26T00:00:00Z"
  },
  "spec": {
    "runtimeClass": "notebook",
    "languages": ["python", "javascript", "sql"],
    "channels": [
      {"name": "nixpkgs", "type": "nixpkgs", "trusted": true},
      {"name": "conda-forge", "type": "conda-forge", "trusted": true},
      {"name": "prophet-core", "type": "prophet", "trusted": true}
    ],
    "build": {
      "system": "mixed",
      "entrypoint": "runtimes/prophet-python-ml/flake.nix",
      "lockfile": "runtimes/prophet-python-ml/flake.lock",
      "sourceRef": "local",
      "builderId": "lattice-forge-demo-builder"
    },
    "artifacts": [
      {"name": "runtime-image", "role": "oci-image", "digest": "sha256:2222222222222222222222222222222222222222222222222222222222222222"},
      {"name": "runtime-sbom", "role": "sbom", "digest": "sha256:3333333333333333333333333333333333333333333333333333333333333333"}
    ],
    "provenance": {
      "attestations": ["slsa", "in-toto"],
      "sourceRefs": ["local-source-ref"],
      "builderId": "lattice-forge-demo-builder"
    },
    "sbom": {
      "formats": ["spdx", "cyclonedx"],
      "digest": "sha256:5555555555555555555555555555555555555555555555555555555555555555"
    },
    "signature": {
      "type": "sigstore",
      "bundleRef": "demo-bundle",
      "digest": "sha256:6666666666666666666666666666666666666666666666666666666666666666"
    },
    "scan": {"vulnerability": "pass", "license": "pass", "policy": "pass"},
    "policy": {"network": "restricted", "secrets": "scoped", "accelerators": ["cpu"], "defaultIsolation": "container"},
    "compatibility": {
      "surfaces": [
        "jupyter",
        "jupyterlab",
        "zeppelin",
        "observable",
        "quarto",
        "lattice-studio",
        "ray",
        "beam",
        "agentplane",
        "sourceos-user",
        "prophet-platform"
      ]
    },
    "telemetry": {"traceRequired": true, "metricSet": ["build-duration", "scan-duration", "artifact-size", "promotion-result"]},
    "promotion": {"channel": "dev", "rollbackRef": "runtime/prophet-python-ml/0.0.1"}
  }
}
